{
  "session_id": "2026-10-09-pr134-review-fixes",
  "started_at": "2026-10-09T13:23:00Z",
  "completed_at": "2026-10-09T13:40:00Z",
  "requirement": "Address PR #134 review feedback: class-level canonical TestCategory tags on the touched test classes, OS-appropriate cleanup of long temporary test trees, removal of Reqnroll-only preconditions from the review skill, and evidence timestamps aligned with the commits they describe.",
  "change_class": "B",
  "consent_reference": "Operator enabled Auto-fix on PR #134 (2026-10-09), authorising fixes to reported review feedback.",
  "activity": "harness",
  "files_changed": [
    "tests/DevOpsMigrationPlatform.Infrastructure.Agent.Tests/Storage/Package/ActivePackageAccessLongPathTests.cs",
    "tests/DevOpsMigrationPlatform.Infrastructure.Agent.Tests/Import/SqliteIdMapStoreTests.cs",
    ".agents/skills/review/SKILL.md",
    "Logs/atdd-sessions/2026-10-09-speckit-upgrade-rationalise.json",
    "Logs/atdd-sessions/2026-10-09-sqlite-long-path.json",
    "Logs/atdd-sessions/2026-10-09-pr134-review-fixes.json"
  ],
  "suites": [
    { "suite": "UnitTests", "run": true, "passed": 1042, "failed": 0 },
    { "suite": "DomainTests", "run": true, "passed": 44, "failed": 0 },
    { "suite": "IntegrationTests", "run": true, "passed": 655, "failed": 0 },
    { "suite": "SystemTest_Simulated", "run": true, "passed": 48, "failed": 0 },
    {
      "suite": "SystemTest_Live",
      "run": false,
      "not_run_reason": "Only test cleanup, test tags, a skill document and evidence timestamps changed; no production or connector code."
    },
    {
      "suite": "SystemTest_Smoke",
      "run": false,
      "not_run_reason": "Smoke is the CI critical-path subset of suites already run in full locally; executes on the PR."
    }
  ],
  "assumptions": [],
  "deviations": [
    "As before, DevOpsMigrationPlatform.TfsMigrationAgent.Tests (net481: 36 UnitTests, 13 IntegrationTests, included above) ran from a subst drive, because the .NET Framework test host cannot discover tests at the deep worktree path."
  ],
  "risks": [],
  "docs_updated": [
    ".agents/skills/review/SKILL.md"
  ],
  "outcome": "SUCCESS"
}
