{
  "session_id": "2026-10-14-migration-assessment-backlog-workflow",
  "started_at": "2026-10-13T09:00:00Z",
  "completed_at": "2026-10-14T18:00:00Z",
  "requirement": "Assess the platform as a replacement for azure-devops-migration-tools; add the parity assessment to the README; introduce a Backlog Item workflow (pre-start sizing, sub-issues with parent kept open, completion protocol, Backlog Item DoD) with issue/PR templates, skills and dynamic workflows; adopt the azure-devops-migration-tools live-test conventions; record a scoped standing authorisation; correct architecture docs, ADR status and guardrails that contradicted the code about the two-agent (net481/net10) model, Azure Blob storage, login and the --mode flag; create the gap backlog as GitHub issues #135-#177.",
  "change_class": "C",
  "consent_reference": "Operator approved in-session (2026-10-13/14): 'yes, draft the capability DoD and issue templates'; Backlog Item model with parent kept open until all children close; 'one target project per worktree, yes authorised, build slice 1'; 'adopt the same test infrastructure ... same auth and setup'; 'please fix all the docs here'; 'yes, create the issues'; 'yes, commit and open a PR'. Recorded as ADR-0034.",
  "activity": "harness",
  "files_changed": [
    ".agents/10-contracts/consent-policy.yaml",
    ".agents/10-contracts/routing-catalog.yaml",
    ".agents/10-contracts/schemas/consent-policy.schema.json",
    ".agents/20-guardrails/domains/control-plane-rules.md",
    ".agents/20-guardrails/workflow/backlog-item-workflow.md",
    ".agents/20-guardrails/workflow/live-test-environment.md",
    ".agents/30-context/domains/decision-records-summary.md",
    ".agents/skills/nkda-backlog-item-create/SKILL.md",
    ".agents/skills/nkda-backlog-item-prestart/SKILL.md",
    ".agents/workflows/nkda-backlog-deliver-workflow.js",
    ".agents/workflows/nkda-backlog-groom-workflow.js",
    ".github/ISSUE_TEMPLATE/backlog-item.md",
    ".github/ISSUE_TEMPLATE/decision.md",
    ".github/PULL_REQUEST_TEMPLATE.md",
    "README.md",
    "docs/**",
    "src/DevOpsMigrationPlatform.Infrastructure.TfsObjectModel/AGENTS.md",
    "src/DevOpsMigrationPlatform.TfsMigrationAgent/AGENTS.md",
    "Logs/atdd-sessions/2026-10-14-migration-assessment-backlog-workflow.json",
    ".agents/20-guardrails/workflow/completion-protocol.md",
    ".agents/20-guardrails/workflow/backlog-item-dod.md",
    ".agents/40-stubs/net481.md",
    ".agents/20-guardrails/README.md",
    ".agents/90-index/guardrails-index.md"
  ],
  "suites": [
    {
      "suite": "UnitTests",
      "run": false,
      "not_run_reason": "Attempted: `dotnet test --filter TestCategory=UnitTests` fails at restore on the base commit ff2e74b8 — NuGet audit (warnings-as-errors) rejects System.Security.Cryptography.Pkcs 10.0.12 (GHSA-2fmv-rv2c-59x7, GHSA-846f-f764-76mx) and System.Security.Cryptography.Xml 10.0.12 (GHSA-7hqp-7c5m-4vq6, GHSA-c399-9853-6jmj). Pre-existing on main, unrelated to this change; no executable code changed here."
    },
    {
      "suite": "DomainTests",
      "run": false,
      "not_run_reason": "No production or test code changed (docs, templates, agent harness only)."
    },
    {
      "suite": "IntegrationTests",
      "run": false,
      "not_run_reason": "No production or test code changed (docs, templates, agent harness only)."
    },
    {
      "suite": "SystemTest_Simulated",
      "run": false,
      "not_run_reason": "No production or test code changed (docs, templates, agent harness only)."
    },
    {
      "suite": "SystemTest_Live",
      "run": false,
      "not_run_reason": "No production or test code changed; the src/ changes are two AGENTS.md documentation files."
    },
    {
      "suite": "SystemTest_Smoke",
      "run": false,
      "not_run_reason": "Runs in CI on the PR; no executable code changed."
    }
  ],
  "assumptions": [
    "Doc corrections were verified against code at ff2e74b8: QueueCommand.GetConnectors and JobStore.DequeueAsync (routing), TfsJobAgentWorker (capabilities, job kinds), LocalStackHost and AgentLifecycleService (hosting, TFS agent spawned once without restart), ManageLoginCommand (stub), and the absence of any Azure Blob artefact store (removed in 40935e1c).",
    "The agent-contract validator (scripts/guardrails/validate-agent-contracts.py) and orchestrator validator pass after the consent-policy schema extension; both workflow scripts parse with node --check.",
    "An Entra ID access token is accepted wherever a PAT is (verified HTTP 200 with Basic auth against nkdagility-adomt-source, -target and nkdagility-preview); live-test-environment.md and ADR-0034 were corrected accordingly."
  ],
  "deviations": [
    "Neither workflow has been executed yet; they are validated for syntax only. First use is planned as groom (report mode) then deliver (dryRun) on pilot items.",
    "About 20 AGENTS.md/CLAUDE.md files showed LF/CRLF-only working-tree differences unrelated to this work; they are not included.",
    "No test suite could be executed: restore fails on main because of newly published advisories against System.Security.Cryptography.Pkcs/Xml 10.0.12 (NU1902/NU1903 as errors). Outcome recorded as PARTIAL rather than claiming suites.",
    "Review round 1 (29 comments): backlog-item-workflow.md split into backlog-item-workflow.md / completion-protocol.md / backlog-item-dod.md to meet the 1,200-word guardrail limit; guardrails ratified by the operator on 2026-10-15 (draft status removed); TFS AGENTS.md corrections moved to the canonical .agents/40-stubs/net481.md (the AGENTS.md files are hardlinks to it, which caused the duplicated text)."
  ],
  "risks": [
    "Live E2E (completion protocol step 3) is BLOCKED until operator PATs are configured or Entra ID auth (#140) and the E2E harness (#142) land.",
    "A single TFS-source/ADO-target config is not routable (re-queues indefinitely); documented with a two-job workaround and tracked as #169.",
    "Docs now state several current gaps (net481 #if guards, TFS agent not restarted, no blob store, login stub) that earlier docs presented as working.",
    "main does not restore/build until the System.Security.Cryptography.Pkcs/Xml pins are bumped; every PR (including this one) will fail build CI until then."
  ],
  "docs_updated": [
    "README.md",
    "docs/architecture.md",
    "docs/agent-hosting.md",
    "docs/capabilities-guide.md",
    "docs/cli-guide.md",
    "docs/control-plane.md",
    "docs/development-setup.md",
    "docs/getting-started.md",
    "docs/tui-guide.md",
    "docs/migration-process-guide.md",
    "docs/work-item-iteration-guide.md",
    "docs/concurrent-write-detection.md",
    "docs/adr/0007-compiler-enforced-project-boundaries.md",
    "docs/adr/0018-compatibility-only-guard-clauses.md",
    "docs/adr/0030-team-orchestrator-unification-and-phase-neutral-renames.md",
    "docs/adr/0034-backlog-item-workflow-and-standing-automation-authorisation.md",
    "docs/adr/README.md"
  ],
  "outcome": "PARTIAL"
}
